{
  "schema_version": 1,
  "project": "example-app",
  "generated_at": "2026-07-06T00:00:00Z",
  "evidence": [
    {
      "id": "EVD-016-A",
      "type": "test_result",
      "result_status": "missing",
      "produced_by": "TBT-016-ASVS-A",
      "observed": false,
      "evidence_strength": "strong",
      "fr_refs": ["FR-016"],
      "ruleset_refs": [
        {"ruleset": "ASVS", "row": "v5.0.0-5.1.1"}
      ],
      "source": "junit/session-timeout.xml",
      "source_locator": "testcase session_timeout",
      "artifact": {
        "path": "junit/session-timeout.xml",
        "format": "junit",
        "bytes": 2048,
        "sha256": "1111111111111111111111111111111111111111111111111111111111111111",
        "locator": "testcase session_timeout",
        "schema_ref": "https://llg.cubic.org/docs/junit/"
      },
      "provenance": {
        "collector": "VG_TEST_FRAMEWORK",
        "collected_at": "2026-07-06T00:00:00Z",
        "tool": "jest",
        "command": ["npm", "test", "--", "TBT-016-ASVS-A"],
        "input_artifacts": [
          {
          "path": "generated-tests/VG_TEST_FRAMEWORK/manifest.json",
          "format": "json",
          "schema_ref": "data/schemas/assurance-test-pack.schema.json",
          "sha256": "2222222222222222222222222222222222222222222222222222222222222222"
        }
        ],
        "output_artifacts": [
          {
            "path": "junit/session-timeout.xml",
            "format": "junit",
            "sha256": "1111111111111111111111111111111111111111111111111111111111111111"
          }
        ]
      },
      "inputs": [
        {
          "path": "generated-tests/VG_TEST_FRAMEWORK/manifest.json",
          "format": "json",
          "sha256": "2222222222222222222222222222222222222222222222222222222222222222"
        },
        {
          "path": "tests/asvs/integration/TBT-016-ASVS-A.assurance.test.js",
          "format": "test_source"
        }
      ],
      "outputs": [
        {
          "path": "junit/session-timeout.xml",
          "format": "junit",
          "schema_ref": "https://llg.cubic.org/docs/junit/",
          "sha256": "1111111111111111111111111111111111111111111111111111111111111111"
        }
      ],
      "side_effects": [
        {
          "type": "process_execution",
          "target": "jest",
          "description": "Runs the approved assurance test. The test is expected to be non-destructive and must not modify product behaviour.",
          "mode": "non_destructive"
        },
        {
          "type": "file_write",
          "target": "junit/session-timeout.xml",
          "description": "Writes scanner-readable JUnit XML used by the assurance report.",
          "mode": "observed"
        }
      ],
      "test_actions": [
        {
          "type": "testcase_execution",
          "name": "TBT-016-ASVS-A",
          "target": "tests/asvs/integration/TBT-016-ASVS-A.assurance.test.js",
          "status": "passed",
          "description": "Executed the approved assurance testcase and captured its result in JUnit XML."
        },
        {
          "type": "junit_identity_recorded",
          "name": "TBT-016-ASVS-A.FR-016.Session-timeout",
          "target": "testcase session_timeout",
          "status": "passed",
          "description": "Recorded the TBT identifier in JUnit classname/name so the scanner can join evidence back to the FR/TBT graph."
        }
      ]
    },
    {
      "id": "EVD-016-B",
      "type": "scanner_result",
      "result_status": "partial",
      "produced_by": "TBT-016-ASVS-B",
      "observed": true,
      "evidence_strength": "supporting",
      "fr_refs": ["FR-016"],
      "ruleset_refs": [
        {"ruleset": "ASVS", "row": "v5.0.0-5.1.1"}
      ],
      "source": "semgrep.sarif",
      "source_locator": "rule python.flask.security.injection",
      "tool": "semgrep",
      "run_id": "semgrep-example-run",
      "artifact": {
        "path": "semgrep.sarif",
        "format": "sarif",
        "sha256": "3333333333333333333333333333333333333333333333333333333333333333",
        "locator": "rule python.flask.security.injection",
        "schema_ref": "https://json.schemastore.org/sarif-2.1.0.json"
      },
      "raw_artifacts": [
        {
          "path": "semgrep.sarif",
          "format": "sarif",
          "schema_ref": "https://json.schemastore.org/sarif-2.1.0.json",
          "sha256": "3333333333333333333333333333333333333333333333333333333333333333"
        }
      ],
      "normalized_finding": {
        "scanner": "semgrep",
        "finding_id": "semgrep-python.flask.security.injection-example",
        "rule_id": "python.flask.security.injection",
        "severity": "high",
        "location": "app.py:12",
        "message": "Potential injection vulnerability.",
        "fingerprint": "4444444444444444444444444444444444444444444444444444444444444444",
        "raw_artifact_path": "semgrep.sarif",
        "raw_artifact_sha256": "3333333333333333333333333333333333333333333333333333333333333333"
      },
      "mapping_refs": [
        {
          "mapping_id": "semgrep-python-flask-injection-asvs",
          "mapping_pack": "scanner-compliance-mapping-pack.example.json",
          "ruleset": "ASVS",
          "row": "v5.0.0-5.1.1",
          "selector": "rule_id=python.flask.security.injection"
        }
      ],
      "provenance": {
        "collector": "assurance-scan",
        "collected_at": "2026-07-06T00:00:00Z",
        "tool": "semgrep",
        "tool_version": "1.0",
        "container_image": "semgrep/semgrep:latest",
        "command": ["semgrep", "scan", "--sarif"],
        "output_artifacts": [
          {
            "path": "semgrep.sarif",
            "format": "sarif",
            "sha256": "3333333333333333333333333333333333333333333333333333333333333333"
          }
        ],
        "normalizer": "assurance-scan.semgrep-sarif"
      },
      "metadata": {
        "scanner_result": "no_findings",
        "rule_id": "python.flask.security.injection"
      },
      "inputs": [],
      "outputs": [
        {
          "path": "semgrep.sarif",
          "format": "sarif",
          "schema_ref": "https://json.schemastore.org/sarif-2.1.0.json",
          "sha256": "3333333333333333333333333333333333333333333333333333333333333333"
        }
      ],
      "side_effects": [
        {
          "type": "scanner_execution",
          "target": "semgrep",
          "description": "Runs or imports scanner output as read-only security evidence for the selected report.",
          "mode": "read_only_analysis"
        }
      ]
    },
    {
      "id": "EVD-GATE-03-ATT-PACK",
      "type": "document",
      "result_status": "manual_review",
      "produced_by": "TBT-016-ASVS-C",
      "observed": true,
      "evidence_strength": "manual_review",
      "fr_refs": ["FR-016"],
      "ruleset_refs": [
        {"ruleset": "ASVS", "row": "v5.0.0-5.1.1"}
      ],
      "assurance_refs": [
        {
          "assurance_framework": "JSP-453",
          "flow_id": "jsp453-assurance-path",
          "gate_id": "GATE-03-ATT",
          "criterion_id": "CRIT-GATE-03-01"
        }
      ],
      "source": "ATT submission pack",
      "source_locator": "section pending",
      "reviewer": "security-assessor"
    }
  ]
}
